"The test is designed to answer the question, ""when will machines become persons?""",What is the original Turing Test?,What is the definition of moral standing?,What is the jus in bello princille?,What specific question is the Turing Triage Test designed to answer?,What specific question is the Turing Triage Test designed to answer?
"Switching it off will have the unfortunate consequence of fusing its circuit boards, rendering it permanently inoperable.","In the hospital triage scenario, what causes the catastrophic power loss?","In the hospital triage scenario, what is the AI pleading for?","In the hospital triage scenario, what is the stated consequence of switching off the AI?","In the hospital triage scenario, what is the first decision the medical officer must make?","In the hospital triage scenario, what is the stated consequence of switching off the AI?"
When saving an AI or a human has the same character as saving a human or a human.,"According to the text, when will machines be able to pass the Turing Test?","According to the text, when will machines be considered ""autonomous moral agents""?","According to the text, when will machines be able to replace human warfighters?","According to the text, when will machines have achieved the moral status of persons?","According to the text, when will machines have achieved the moral status of persons?"
"It is part of a broader family of ML methods based on learning data representations, as opposed to task-specific algorithms.",What is Supervised Learning?,What are decision trees?,What is Deep Learning?,What is reinforcement learning?,What is Deep Learning?
These are computer networks that use wireless data connections between work nodes.,What are decision trees?,What is the Internet of Things (IoT)?,What is Deep Learning?,What are advanced wireless networks?,What are advanced wireless networks?
"Supervised learning, unsupervised learning, and reinforcement learning",What are the key features of advanced wireless networks?,What are the branches and leaves of a decision tree?,What are the different types of data representations?,What are the three main categories of machine learning?,What are the three main categories of machine learning?
They are common machine learning techniques that are relatively simple to use and illustrate. They are used to explicitly represent decisions using branches and leaves.,What are advanced wireless networks?,"What are ""work nodes""?",What is Deep Learning?,What are decision trees?,What are decision trees?
The Singularity Is Near,"What book suggests that AGI will be achieved by 2030 and by 2045 ASI will have defeated war, disease, poverty, and personal death?","What book suggests that ABC will be achieved by 2080 and by 2085 ABI will have defeated war, disease, poverty, and death?",What paper suggests that AI will defeat human purpose?,What book suggests that AI will surpass human capabilities by the year 2035?,"What book suggests that AGI will be achieved by 2030 and by 2045 ASI will have defeated war, disease, poverty, and personal death?"
“Jack” Good,Who predicted an Artificial Intelligence who would surpass physical activities of any man?,Who predicted an ultraintelligent machine who would far surpass all the intellectual activities of any man how-ever clever?,Who predicted an intelligent machine that will defeat all wars?,Who made the Turing Triage Test?,Who predicted an ultraintelligent machine who would far surpass all the intellectual activities of any man how-ever clever?
The distinction between human and machine and the distinction between physical and virtual reality.,What key distinctions does Kurzweil predict will no longer exist in the world that result from it?,What are the two main arguments against Singularity?,What are the two definitions of Artificial General Intelligence (AGI)?,What are the two primary goals of the Turing Triage Test?,What key distinctions does Kurzweil predict will no longer exist in the world that result from it?