"The former player tries to maximize the game's outcome while the latter player tries to minimize the outcome for the Max player",How would you apply the Alpha-Beta Pruning algorithm to a competitive two-player game?,How would you apply the Minimax algorithm to a competitive two-player game?,"In minimax search, what is the role of the 'Max' player and the 'Min' player?",How would you apply the brute force search to a competitive two-player game?,"In minimax search, what is the role of the 'Max' player and the 'Min' player?"
"This effect occurs when a search depth is limited, and a significant change (like an inevitable loss of material) is pushed just beyond the search horizon, leading to misleading evaluations and potentially weaker play",When is the combinatorial explosion seen in computer game playing programs?,When is the concept of a heuristic seen in computer game playing programs?,When is the “Horizon Effect” seen in computer game playing programs?,When is the concept of an optimal move seen in computer game playing programs?,When is the “Horizon Effect” seen in computer game playing programs?
The system needs to find a diagnosis (the goal) based on a patient's symptoms (the premises). It then works backward from a potential diagnosis to see if the symptoms support it.,How would you apply backward search in a medical diagnosis expert system?,How would you apply forward search in a medical diagnosis expert system?,How would you apply a heuristic search in a medical diagnosis expert system?,How would you apply an uninformed search in a medical diagnosis expert system?,How would you apply backward search in a medical diagnosis expert system?
"When finding the most efficient route for a delivery truck to visit 50 different locations, you take into account the route that uses the least amount of gas and time by using features of uniform cost search and pure heuristic search.",How would you apply the Hill Climbing algorithm to a delivery problem?,How would you apply a Depth-First Search in a delivery route?,How would you apply a Breadth-First Search to find the shortest delivery route?,How would you apply the concept of an A* Algorithm in solving for the most optimal path in a delivery route?,How would you apply the concept of an A* Algorithm in solving for the most optimal path in a delivery route?
The engine needs to use a method that can assess the value of each piece's position and the overall strategic advantage.,How would you apply a brute force search to a chess game?,How would you apply a heuristic evaluation function to a chess game?,How would you apply a hill-climbing algorithm to a chess game?,How would you apply a best-first search to a chess game?,How would you apply a heuristic evaluation function to a chess game?
The system will start with the symptoms and infer a diagnosis.,How would you apply Backward Search in a medical diagnosis expert system?,How would you apply a Heuristic Search in a medical diagnosis expert system?,How would you apply a Depth-First Search in a medical diagnosis expert system?,How would you apply Forward Search in a medical diagnosis expert system to infer a diagnosis from symptoms?,How would you apply Forward Search in a medical diagnosis expert system to infer a diagnosis from symptoms?
When a system is struggling to process information efficiently because the search space is too large.,When is a Beam Search used as an effective real-life application?,When is a Hill Climbing search used as an effective real-life application?,When is a Breadth-First search used as an effective real-life application?,When is a A* algorithm used as an effective real-life application?,When is a Beam Search used as an effective real-life application?
When it makes blunders or sacrifices a piece because its maximum search depth is too shallow to detect the opponent's winning move,How would you apply the concept of a horizon effect to explain a chess bot’s poor performance?,How would you apply the concept of a combinatorial explosion to explain a chess bot’s poor performance?,How would you apply the concept of a heuristic to explain a chess bot’s poor performance?,How would you apply the concept of an optimal move to explain a chess bot’s poor performance?,How would you apply the concept of a horizon effect to explain a chess bot’s poor performance?
When a game can become so intricate that it becomes impossible for an AI to analyze every single possibility.,What problem is best alleviated by a heuristic in a complex game?,What problem is best alleviated by a brute force algorithm in a complex game?,What problem is best alleviated by a minimax algorithm in a complex game?,What problem is best alleviated by a quiescence searching in a complex game?,What problem is best alleviated by a heuristic in a complex game?
"When you consider all possible check moves from an opponent, even if those checks occur at a search depth beyond its normal limit.",How do you apply quiescence searching to reduce the horizon effect on your chess engine?,How do you apply brute force search to reduce the horizon effect on your chess engine?,How do you apply a heuristic to reduce the horizon effect on your chess engine?,How do you apply check extensions to reduce the horizon effect on your chess engine?,How do you apply check extensions to reduce the horizon effect on your chess engine?
